{
    "$schema": "http://json-schema.org/draft-07/schema#",
    "title": "Malware",
    "description": "OCSF schema for normalized malware detection events (e.g. Bitdefender)",
    "type": "object",
    "required": ["class_uid", "category_uid", "metadata", "time", "severity", "user", "src_endpoint", "malware"],
    "properties": {
      "class_uid": { "type": "integer" },
      "category_uid": { "type": "integer" },
      "metadata": { "type": "object" },
      "time": { "type": "string" },
      "severity": { "type": "string" },
      "status": { "type": "string" },
      "user": {
        "type": "object",
        "properties": {
          "uid": { "type": "string" },
          "name": { "type": "string" }
        }
      },
      "src_endpoint": {
        "type": "object",
        "properties": {
          "ip": { "type": "string" },
          "hostname": { "type": "string" }
        }
      },
      "malware": {
        "type": "object",
        "properties": {
          "name": { "type": "string" },
          "path": { "type": "string" }
        }
      },
      "disposition": { "type": "string" }
    }
  }
  